Origin Organizations,Cleaned,Filled
"physikalisches institut, university of bonn, bonn, germany.","physikalisches institut, university of bonn, bonn, germany.","physikalisches institut, university of bonn, bonn, germany."
"seoul national university, seoul, south korea","seoul natl univ, seoul, south korea","seoul national university, seoul, south korea"
ben gurion university of the negev,ben gurion university of the negev,ben gurion university of the negev
moscow,moscow,moscow
"dalian institute of chemical physics chinese academy of sciences(chinese academy of sciences),dalian,china","dalian institute of chemical physics chinese academy of sciences(chinese academy of sciences),dalian,china","dalian institute of chemical physics chinese academy of sciences(chinese academy of sciences),dalian,china"
"ningbo university(ningbo university),ningbo,china","ningbo university(ningbo university),ningbo,china","ningbo university(ningbo university),ningbo,china"
"university calif los angeles, los angeles, ca 90095 usa","univ calif los angeles, los angeles, ca 90095 usa","university calif los angeles, los angeles, ca 90095 usa"
"east china normal university(east china normal university),shanghai,china","east china normal university(east china normal university),shanghai,china","east china normal university(east china normal university),shanghai,china"
"nanjing medical university(nanjing medical university),nanjing,china","nanjing medical university(nanjing medical university),nanjing,china","nanjing medical university(nanjing medical university),nanjing,china"
"university sciences and technology beijing, sch materials sciences and engineering, beijing 100083, peoples r china","univ sci & technol beijing, sch mat sci & engn, beijing 100083, peoples r china","university sciences and technology beijing, sch materials sciences and engineering, beijing 100083, peoples r china"
"beijing university posts and telecommunications, state key laboratory informat photon and opt commun, beijing 100876, peoples r china","beijing univ posts & telecommun, state key lab informat photon & opt commun, beijing 100876, peoples r china","beijing university posts and telecommunications, state key laboratory informat photon and opt commun, beijing 100876, peoples r china"
universidade federal do espirito santo,universidade federal do espirito santo,universidade federal do espirito santo
"southern medical university(^ southern medical university),tonghe,china","southern medical university(^ southern medical university),tonghe,china","southern medical university(^ southern medical university),tonghe,china"
"university calif los angeles, department physics and astron, los angeles, ca 90095 usa","univ calif los angeles, dept phys & astron, los angeles, ca 90095 usa","university calif los angeles, department physics and astron, los angeles, ca 90095 usa"
"university n carolina, department chemical, chapel hill, nc 27599 usa","univ n carolina, dept chem, chapel hill, nc 27599 usa","university n carolina, department chemical, chapel hill, nc 27599 usa"
"penn state university, department chemical, university pk, pa 16802 usa","penn state univ, dept chem, university pk, pa 16802 usa","penn state university, department chemical, university pk, pa 16802 usa"
"johns hopkins university hospital, baltimore, md 21287 usa","johns hopkins univ hosp, baltimore, md 21287 usa","johns hopkins university hospital, baltimore, md 21287 usa"
air force research laboratory,air force research laboratory,air force research laboratory
"third military medical university(third military medical university),chongqing,china","third military medical university(third military medical university),chongqing,china","third military medical university(third military medical university),chongqing,china"
"university roma la sapienza, rome, italy","univ roma la sapienza, rome, italy","university roma la sapienza, rome, italy"
"xi'an university of architecture and technology(xi'an university of architecture and technology,xi'an univ. of arch. and tech.),xi an,china","xi'an university of architecture and technology(xi'an university of architecture and technology,xi'an univ. of arch. and tech.),xi an,china","xi'an university of architecture and technology(xi'an university of architecture and technology,xi'an univ. of arch. and tech.),xi an,china"
"institute of chemistry chinese academy of sciences(chinese academy of sciences,institute of chemistry),beijing,china","institute of chemistry chinese academy of sciences(chinese academy of sciences,institute of chemistry),beijing,china","institute of chemistry chinese academy of sciences(chinese academy of sciences,institute of chemistry),beijing,china"
"university wisconsin, department chemical, madison, wi 53706 usa","univ wisconsin, dept chem, madison, wi 53706 usa","university wisconsin, department chemical, madison, wi 53706 usa"
"deutsches elektronen-synchrotron,hamburg,germany","deutsches elektronen-synchrotron,hamburg,germany","deutsches elektronen-synchrotron,hamburg,germany"
"harbin medical university(harbin medical university),harbin,china","harbin medical university(harbin medical university),harbin,china","harbin medical university(harbin medical university),harbin,china"
"shenyang university of technology(shenyang university of technology),shenyang,china","shenyang university of technology(shenyang university of technology),shenyang,china","shenyang university of technology(shenyang university of technology),shenyang,china"
brigham and women s hospital,brigham and women s hospital,brigham and women s hospital
"university calif santa barbara, department physics, santa barbara, ca 93106 usa","univ calif santa barbara, dept phys, santa barbara, ca 93106 usa","university calif santa barbara, department physics, santa barbara, ca 93106 usa"
"argonne national laboratory, argonne, il 60439 usa","argonne natl lab, argonne, il 60439 usa","argonne national laboratory, argonne, il 60439 usa"
"sandia national labs, pob 5800, albuquerque, nm 87185 usa","sandia natl labs, pob 5800, albuquerque, nm 87185 usa","sandia national labs, pob 5800, albuquerque, nm 87185 usa"
"shanghai institute of ceramics chinese academy of sciences(chinese academy of sciences),shanghai,china","shanghai institute of ceramics chinese academy of sciences(chinese academy of sciences),shanghai,china","shanghai institute of ceramics chinese academy of sciences(chinese academy of sciences),shanghai,china"
www.bsl.nl,www.bsl.nl,www.bsl.nl
"roswell pk canc institute, buffalo, ny 14263 usa","roswell pk canc inst, buffalo, ny 14263 usa","roswell pk canc institute, buffalo, ny 14263 usa"
"chinese academy sciences, institute plasma physics, hefei 230031, peoples r china","chinese acad sci, inst plasma phys, hefei 230031, peoples r china","chinese academy sciences, institute plasma physics, hefei 230031, peoples r china"
"university s carolina, columbia, sc 29208 usa","univ s carolina, columbia, sc 29208 usa","university s carolina, columbia, sc 29208 usa"
"huazhong agricultural university(huazhong agricultural university),wuhan,china","huazhong agricultural university(huazhong agricultural university),wuhan,china","huazhong agricultural university(huazhong agricultural university),wuhan,china"
"china earthquake administration(^ china earthquake administration),beijing,china","china earthquake administration(^ china earthquake administration),beijing,china","china earthquake administration(^ china earthquake administration),beijing,china"
"katholieke university leuven, leuven, belgium","katholieke univ leuven, leuven, belgium","katholieke university leuven, leuven, belgium"
university of concepcion,university of concepcion,university of concepcion
"university health network, toronto, on, canada","univ hlth network, toronto, on, canada","university health network, toronto, on, canada"
"xiangya hospital of central-south university(xiangya hospital,central south university),changsha,china","xiangya hospital of central-south university(xiangya hospital,central south university),changsha,china","xiangya hospital of central-south university(xiangya hospital,central south university),changsha,china"
"johns hopkins sch medicine, baltimore, md usa","johns hopkins sch med, baltimore, md usa","johns hopkins sch medicine, baltimore, md usa"
"st louis university, st louis, mo 63103 usa","st louis univ, st louis, mo 63103 usa","st louis university, st louis, mo 63103 usa"
"lanzhou university of technology(lanzhou university of technology),lanzhou,china","lanzhou university of technology(lanzhou university of technology),lanzhou,china","lanzhou university of technology(lanzhou university of technology),lanzhou,china"
"hospital valle de hebron, stroke unit, barcelona, spain","hosp valle de hebron, stroke unit, barcelona, spain","hospital valle de hebron, stroke unit, barcelona, spain"
"changchun institute of applied chemistry chinese academy of sciences(chinese academy of sciences),shanghai,china","changchun institute of applied chemistry chinese academy of sciences(chinese academy of sciences),shanghai,china","changchun institute of applied chemistry chinese academy of sciences(chinese academy of sciences),shanghai,china"
"texas stroke institute, dallas, tx usa","texas stroke inst, dallas, tx usa","texas stroke institute, dallas, tx usa"
"hannover medicine sch, hannover, germany","hannover med sch, hannover, germany","hannover medicine sch, hannover, germany"
"university hospital cleveland, cleveland, oh usa","univ hosp cleveland, cleveland, oh usa","university hospital cleveland, cleveland, oh usa"
"hop gui de chauliac, department neuroradiol, montpellier, france","hop gui de chauliac, dept neuroradiol, montpellier, france","hop gui de chauliac, department neuroradiol, montpellier, france"
"ohiohealth riverside methodist hospital, columbus, oh usa","ohiohealth riverside methodist hosp, columbus, oh usa","ohiohealth riverside methodist hospital, columbus, oh usa"
"valley baptist medicine center, department neurosci, harlingen, tx usa","valley baptist med ctr, dept neurosci, harlingen, tx usa","valley baptist medicine center, department neurosci, harlingen, tx usa"
"johns hopkins bloomberg sch publ health, baltimore, md usa","johns hopkins bloomberg sch publ hlth, baltimore, md usa","johns hopkins bloomberg sch publ health, baltimore, md usa"
"chinese academy sciences, shanghai institute apply physics, shanghai 201800, peoples r china","chinese acad sci, shanghai inst appl phys, shanghai 201800, peoples r china","chinese academy sciences, shanghai institute apply physics, shanghai 201800, peoples r china"
"ist nazl fis nucl, laboratory nazl frascati, i-00044 frascati, italy","ist nazl fis nucl, lab nazl frascati, i-00044 frascati, italy","ist nazl fis nucl, laboratory nazl frascati, i-00044 frascati, italy"
"huazhong university sciences and technology, wuhan national laboratory optoelect, wuhan 430074, peoples r china","huazhong univ sci & technol, wuhan natl lab optoelect, wuhan 430074, peoples r china","huazhong university sciences and technology, wuhan national laboratory optoelect, wuhan 430074, peoples r china"
"university texas health sciences center houston, houston, tx 77030 usa","univ texas hlth sci ctr houston, houston, tx 77030 usa","university texas health sciences center houston, houston, tx 77030 usa"
"university of wisconsin - madison,madison,u.s.a.","university of wisconsin - madison,madison,u.s.a.","university of wisconsin - madison,madison,u.s.a."
"university s florida, tampa, fl 33620 usa","univ s florida, tampa, fl 33620 usa","university s florida, tampa, fl 33620 usa"
"university so calif, los angeles, ca usa","univ so calif, los angeles, ca usa","university so calif, los angeles, ca usa"
"guangxi university(guangxi university),nanning,china","guangxi university(guangxi university),nanning,china","guangxi university(guangxi university),nanning,china"
"university s florida, tampa, fl usa","univ s florida, tampa, fl usa","university s florida, tampa, fl usa"
"hebei medical university(hebei medical university),shijiazhuang,china","hebei medical university(hebei medical university),shijiazhuang,china","hebei medical university(hebei medical university),shijiazhuang,china"
"cleveland clinic fdn, 9500 euclid ave, cleveland, oh 44195 usa","cleveland clin fdn, 9500 euclid ave, cleveland, oh 44195 usa","cleveland clinic fdn, 9500 euclid ave, cleveland, oh 44195 usa"
"university calif san diego, scripps institute oceanog, la jolla, ca 92093 usa","univ calif san diego, scripps inst oceanog, la jolla, ca 92093 usa","university calif san diego, scripps institute oceanog, la jolla, ca 92093 usa"
"south china agricultural university(south china agricultural university),guangzhou,china","south china agricultural university(south china agricultural university),guangzhou,china","south china agricultural university(south china agricultural university),guangzhou,china"
"university penn, department chemical, philadelphia, pa 19104 usa","univ penn, dept chem, philadelphia, pa 19104 usa","university penn, department chemical, philadelphia, pa 19104 usa"
"kings college hospital london, london, england","kings coll hosp london, london, england","kings college hospital london, london, england"
"university calif santa barbara, department elect and comp engineering, santa barbara, ca 93106 usa","univ calif santa barbara, dept elect & comp engn, santa barbara, ca 93106 usa","university calif santa barbara, department elect and comp engineering, santa barbara, ca 93106 usa"
"south china normal university(south china normal university),guangzhou,china","south china normal university(south china normal university),guangzhou,china","south china normal university(south china normal university),guangzhou,china"
"n carolina state university, raleigh, nc 27695 usa","n carolina state univ, raleigh, nc 27695 usa","n carolina state university, raleigh, nc 27695 usa"
"university calif santa barbara, department materials, santa barbara, ca 93106 usa","univ calif santa barbara, dept mat, santa barbara, ca 93106 usa","university calif santa barbara, department materials, santa barbara, ca 93106 usa"
"beijing forestry university(beijing forestry university),beijing,china","beijing forestry university(beijing forestry university),beijing,china","beijing forestry university(beijing forestry university),beijing,china"
"university calif berkeley, department elect engineering and comp sciences, berkeley, ca 94720 usa","univ calif berkeley, dept elect engn & comp sci, berkeley, ca 94720 usa","university calif berkeley, department elect engineering and comp sciences, berkeley, ca 94720 usa"
"university estadual campinas, campinas, sp, brazil","univ estadual campinas, campinas, sp, brazil","university estadual campinas, campinas, sp, brazil"
"jiangnan university(jiangnan university),wuxi,china","jiangnan university(jiangnan university),wuxi,china","jiangnan university(jiangnan university),wuxi,china"
"nanjing normal university(nanjing normal university),nanjing,china","nanjing normal university(nanjing normal university),nanjing,china","nanjing normal university(nanjing normal university),nanjing,china"
"vrije university amsterdam, amsterdam, netherlands","vrije univ amsterdam, amsterdam, netherlands","vrije university amsterdam, amsterdam, netherlands"
www.zorgenfinanciering.nl,www.zorgenfinanciering.nl,www.zorgenfinanciering.nl
"southwest china normal university(southwest university,southwest china normal university,southwest normal university),chongqing,china","southwest china normal university(southwest university,southwest china normal university,southwest normal university),chongqing,china","southwest china normal university(southwest university,southwest china normal university,southwest normal university),chongqing,china"
"university calif riverside, department chemical, riverside, ca 92521 usa","univ calif riverside, dept chem, riverside, ca 92521 usa","university calif riverside, department chemical, riverside, ca 92521 usa"
"hospital clinic san carlos, madrid, spain","hosp clin san carlos, madrid, spain","hospital clinic san carlos, madrid, spain"
heriot watt university,heriot watt university,heriot watt university
"georgia institute technology, sch chemical and biochem, atlanta, ga 30332 usa","georgia inst technol, sch chem & biochem, atlanta, ga 30332 usa","georgia institute technology, sch chemical and biochem, atlanta, ga 30332 usa"
wien,wien,wien
"huazhong normal university(central china normal university,huazhong normal university),wuhan,china","huazhong normal university(central china normal university,huazhong normal university),wuhan,china","huazhong normal university(central china normal university,huazhong normal university),wuhan,china"
"vrije university amsterdam medicine center, amsterdam, netherlands","vrije univ amsterdam med ctr, amsterdam, netherlands","vrije university amsterdam medicine center, amsterdam, netherlands"
"university fed rio de janeiro, rio de janeiro, brazil","univ fed rio de janeiro, rio de janeiro, brazil","university fed rio de janeiro, rio de janeiro, brazil"
"institut fr physik, universitt mainz, mainz, germany.","institut fr physik, universitt mainz, mainz, germany.","institut fr physik, universitt mainz, mainz, germany."
"yunnan university(yunnan university),kunming,china","yunnan university(yunnan university),kunming,china","yunnan university(yunnan university),kunming,china"
"university central florida, orlando, fl 32816 usa","univ cent florida, orlando, fl 32816 usa","university central florida, orlando, fl 32816 usa"
"yangzhou university(yangzhou university),yangzhou,china","yangzhou university(yangzhou university),yangzhou,china","yangzhou university(yangzhou university),yangzhou,china"
"fred hutchinson canc research center, seattle, wa 98104 usa","fred hutchinson canc res ctr, seattle, wa 98104 usa","fred hutchinson canc research center, seattle, wa 98104 usa"
"new york medicine college, valhalla, ny 10595 usa","new york med coll, valhalla, ny 10595 usa","new york medicine college, valhalla, ny 10595 usa"
"hospital sick children, toronto, on, canada","hosp sick children, toronto, on, canada","hospital sick children, toronto, on, canada"
"bell tel labs inc,murray hill,nj 07974","bell tel labs inc,murray hill,nj 07974","bell tel labs inc,murray hill,nj 07974"
washington university in st louis,washington university in st louis,washington university in st louis
"london sch hyg and trop medicine, london, england","london sch hyg & trop med, london, england","london sch hyg and trop medicine, london, england"
"nanjing university of post and telecommunications(nanjing university of posts and telecommunications),nanjing,china","nanjing university of post and telecommunications(nanjing university of posts and telecommunications),nanjing,china","nanjing university of post and telecommunications(nanjing university of posts and telecommunications),nanjing,china"
"china iron and steel research institute group(central iron and steel research institute,ctrl. iron and stl. res. institute),beijing,china","china iron and steel research institute group(central iron and steel research institute,ctrl. iron and stl. res. institute),beijing,china","china iron and steel research institute group(central iron and steel research institute,ctrl. iron and stl. res. institute),beijing,china"
"pontificia university catolica chile, santiago, chile","pontificia univ catolica chile, santiago, chile","pontificia university catolica chile, santiago, chile"
"chinese academy sciences, changchun institute apply chemical, state key laboratory rare earth resource utilizat, changchun 130022, peoples r china","chinese acad sci, changchun inst appl chem, state key lab rare earth resource utilizat, changchun 130022, peoples r china","chinese academy sciences, changchun institute apply chemical, state key laboratory rare earth resource utilizat, changchun 130022, peoples r china"
dresden university of technology,dresden university of technology,dresden university of technology
"northeast normal university(northeast normal university),changchun,china","northeast normal university(northeast normal university),changchun,china","northeast normal university(northeast normal university),changchun,china"
"north university of china(north university of china),taiyuan,china","north university of china(north university of china),taiyuan,china","north university of china(north university of china),taiyuan,china"
"university calif santa barbara, department chemical and biochem, santa barbara, ca 93106 usa","univ calif santa barbara, dept chem & biochem, santa barbara, ca 93106 usa","university calif santa barbara, department chemical and biochem, santa barbara, ca 93106 usa"
universite du quebec a montreal,universite du quebec a montreal,universite du quebec a montreal
"fakultt fr mathematik und physik, albert-ludwigs-universitt, freiburg, germany.","fakultt fr mathematik und physik, albert-ludwigs-universitt, freiburg, germany.","fakultt fr mathematik und physik, albert-ludwigs-universitt, freiburg, germany."
"max planck institute astron, d-69117 heidelberg, germany","max planck inst astron, d-69117 heidelberg, germany","max planck institute astron, d-69117 heidelberg, germany"
"lawrence berkeley national laboratory, berkeley, ca 94720 usa","lawrence berkeley natl lab, berkeley, ca 94720 usa","lawrence berkeley national laboratory, berkeley, ca 94720 usa"
"university calif berkeley, lawrence berkeley laboratory, berkeley, ca 94720 usa","univ calif berkeley, lawrence berkeley lab, berkeley, ca 94720 usa","university calif berkeley, lawrence berkeley laboratory, berkeley, ca 94720 usa"
"the fourth military medical university(fourth military medical university,the fourth military medical university),xi'an,china","the fourth military medical university(fourth military medical university,the fourth military medical university),xi'an,china","the fourth military medical university(fourth military medical university,the fourth military medical university),xi'an,china"
"guangdong university of technology(guangdong university of technology),guangzhou,china","guangdong university of technology(guangdong university of technology),guangzhou,china","guangdong university of technology(guangdong university of technology),guangzhou,china"
"school of electrical and electronic engineering, nanyang technological university, singapore","school of electrical and electronic engineering, nanyang technological university, singapore","school of electrical and electronic engineering, nanyang technological university, singapore"
"northeast forestry university(northeast forestry university),harbin,china","northeast forestry university(northeast forestry university),harbin,china","northeast forestry university(northeast forestry university),harbin,china"
"duke clinic research institute, durham, nc usa","duke clin res inst, durham, nc usa","duke clinic research institute, durham, nc usa"
"penn state university, department materials sciences and engineering, university pk, pa 16802 usa","penn state univ, dept mat sci & engn, university pk, pa 16802 usa","penn state university, department materials sciences and engineering, university pk, pa 16802 usa"
universidad autonoma metropolitana,universidad autonoma metropolitana,universidad autonoma metropolitana
"guys and st thomas nhs fdn trust, london, england","guys & st thomas nhs fdn trust, london, england","guys and st thomas nhs fdn trust, london, england"
"hangzhou dianzi university(hangzhou dianzi university,hangzhou university),hangzhou,china","hangzhou dianzi university(hangzhou dianzi university,hangzhou university),hangzhou,china","hangzhou dianzi university(hangzhou dianzi university,hangzhou university),hangzhou,china"
both authors contributed equally to this work.,both authors contributed equally to this work.,both authors contributed equally to this work.
"space telescope sciences institute, baltimore, md 21218 usa","space telescope sci inst, baltimore, md 21218 usa","space telescope sciences institute, baltimore, md 21218 usa"
"florida int university, miami, fl 33199 usa","florida int univ, miami, fl 33199 usa","florida int university, miami, fl 33199 usa"
"harvard medicine sch, boston, ma usa","harvard med sch, boston, ma usa","harvard medicine sch, boston, ma usa"
"chinese academy sciences, institute semicond, state key laboratory integrated optoelect, beijing 100083, peoples r china","chinese acad sci, inst semicond, state key lab integrated optoelect, beijing 100083, peoples r china","chinese academy sciences, institute semicond, state key laboratory integrated optoelect, beijing 100083, peoples r china"
"stanford linear accelerator center(stanford university,stanford linear accelerator center),menlo park,united states","stanford linear accelerator center(stanford university,stanford linear accelerator center),menlo park,united states","stanford linear accelerator center(stanford university,stanford linear accelerator center),menlo park,united states"
"national university singapore, department chemical, singapore 117543, singapore","natl univ singapore, dept chem, singapore 117543, singapore","national university singapore, department chemical, singapore 117543, singapore"
"university calif san diego, department medicine, la jolla, ca 92093 usa","univ calif san diego, dept med, la jolla, ca 92093 usa","university calif san diego, department medicine, la jolla, ca 92093 usa"
"bucharest university econ studies, bucharest, romania","bucharest univ econ studies, bucharest, romania","bucharest university econ studies, bucharest, romania"
"budker institute nucl physics, novosibirsk 630090, russia","budker inst nucl phys, novosibirsk 630090, russia","budker institute nucl physics, novosibirsk 630090, russia"
"fox chase canc center, philadelphia, pa 19111 usa","fox chase canc ctr, philadelphia, pa 19111 usa","fox chase canc center, philadelphia, pa 19111 usa"
