Origin Organizations,Cleaned,Filled
corresponding author.,corresponding author.,corresponding author.
university of sao paulo,university of sao paulo,university of sao paulo
university of liege,university of liege,university of liege
"zhejiang university(zhejiang university),hangzhou,china","zhejiang university(zhejiang university),hangzhou,china","zhejiang university(zhejiang university),hangzhou,china"
"harbin institute of technology(harbin institute of technology,harbin inst. of technol.),harbin,china","harbin institute of technology(harbin institute of technology,harbin inst. of technol.),harbin,china","harbin institute of technology(harbin institute of technology,harbin inst. of technol.),harbin,china"
"university texas md anderson canc center, houston, tx 77030 usa","univ texas md anderson canc ctr, houston, tx 77030 usa","university texas md anderson canc center, houston, tx 77030 usa"
university of wisconsin-madison,university of wisconsin-madison,university of wisconsin-madison
"huazhong university of science and technology(huazhong university of science and technology,huazhong univ. of sci. and technol.),wuhan,china","huazhong university of science and technology(huazhong university of science and technology,huazhong univ. of sci. and technol.),wuhan,china","huazhong university of science and technology(huazhong university of science and technology,huazhong univ. of sci. and technol.),wuhan,china"
corresponding authors.,corresponding authors.,corresponding authors.
sao paulo state university,sao paulo state university,sao paulo state university
"peking university(peking university),beijing,china","peking university(peking university),beijing,china","peking university(peking university),beijing,china"
"university calif san francisco, san francisco, ca 94143 usa","univ calif san francisco, san francisco, ca 94143 usa","university calif san francisco, san francisco, ca 94143 usa"
corresponding author,corresponding author,corresponding author
"university penn, philadelphia, pa 19104 usa","univ penn, philadelphia, pa 19104 usa","university penn, philadelphia, pa 19104 usa"
"jilin university(jilin university),changchun,china","jilin university(jilin university),changchun,china","jilin university(jilin university),changchun,china"
"chinese academy of sciences(chinese academy of sciences),beijing,china","chinese academy of sciences(chinese academy of sciences),beijing,china","chinese academy of sciences(chinese academy of sciences),beijing,china"
"sichuan university(sichuan university),chengdu,china","sichuan university(sichuan university),chengdu,china","sichuan university(sichuan university),chengdu,china"
university of wisconsin madison,university of wisconsin madison,university of wisconsin madison
"xi'an jiaotong university(xi'an jiaotong university,xi'an jiaotong univ,xi'an jiaotong univ.),xi an,china","xi'an jiaotong university(xi'an jiaotong university,xi'an jiaotong univ,xi'an jiaotong univ.),xi an,china","xi'an jiaotong university(xi'an jiaotong university,xi'an jiaotong univ,xi'an jiaotong univ.),xi an,china"
"massachusetts general hospital, boston, ma 02114 usa","massachusetts gen hosp, boston, ma 02114 usa","massachusetts general hospital, boston, ma 02114 usa"
"wuhan university(wuhan university),wuhan,china","wuhan university(wuhan university),wuhan,china","wuhan university(wuhan university),wuhan,china"
"dalian university of technology(dalian university of technology,dalian univ. of technol.),dalian,china","dalian university of technology(dalian university of technology,dalian univ. of technol.),dalian,china","dalian university of technology(dalian university of technology,dalian univ. of technol.),dalian,china"
"beijing institute of technology(beijing institute of technology,beijing inst. of technol.),beijing,china","beijing institute of technology(beijing institute of technology,beijing inst. of technol.),beijing,china","beijing institute of technology(beijing institute of technology,beijing inst. of technol.),beijing,china"
"national university of defense technology(national university of defense technology,national univ. of defense technology),changsha,china","national university of defense technology(national university of defense technology,national univ. of defense technology),changsha,china","national university of defense technology(national university of defense technology,national univ. of defense technology),changsha,china"
"central south university china(central south university ^),changsha,china","central south university china(central south university ^),changsha,china","central south university china(central south university ^),changsha,china"
"southeast university(southeast university,southeast univ),nanjing,china","southeast university(southeast university,southeast univ),nanjing,china","southeast university(southeast university,southeast univ),nanjing,china"
to whom correspondence should be addressed.,to whom correspondence should be addressed.,to whom correspondence should be addressed.
"fudan university(fudan university),shanghai,china","fudan university(fudan university),shanghai,china","fudan university(fudan university),shanghai,china"
"university of science and technology of china(university of science and technology of china,univ. of sci. and technol. of china),hefei,china","university of science and technology of china(university of science and technology of china,univ. of sci. and technol. of china),hefei,china","university of science and technology of china(university of science and technology of china,univ. of sci. and technol. of china),hefei,china"
"tongji university(tongji university,tongji univ.),shanghai,china","tongji university(tongji university,tongji univ.),shanghai,china","tongji university(tongji university,tongji univ.),shanghai,china"
"university of science and technology beijing(university of science and technology beijing),beijing,china","university of science and technology beijing(university of science and technology beijing),beijing,china","university of science and technology beijing(university of science and technology beijing),beijing,china"
"shandong university(shandong university),jinan,china","shandong university(shandong university),jinan,china","shandong university(shandong university),jinan,china"
these authors contributed equally to this work.,these authors contributed equally to this work.,these authors contributed equally to this work.
"nanjing university(nanjing university),nanjing,china","nanjing university(nanjing university),nanjing,china","nanjing university(nanjing university),nanjing,china"
auteur correspondant.,auteur correspondant.,auteur correspondant.
"northeastern university china(northeastern university,northeastern univ.),shenyang,china","northeastern university china(northeastern university,northeastern univ.),shenyang,china","northeastern university china(northeastern university,northeastern univ.),shenyang,china"
"baylor college medicine, houston, tx 77030 usa","baylor coll med, houston, tx 77030 usa","baylor college medicine, houston, tx 77030 usa"
"fermilab national accelerator laboratory, batavia, il 60510 usa","fermilab natl accelerator lab, batavia, il 60510 usa","fermilab national accelerator laboratory, batavia, il 60510 usa"
"university calif los angeles, los angeles, ca usa","univ calif los angeles, los angeles, ca usa","university calif los angeles, los angeles, ca usa"
"northwestern polytechnical university(northwestern polytechnical university,northwestern polytechnical univ),xi'an,china","northwestern polytechnical university(northwestern polytechnical university,northwestern polytechnical univ),xi'an,china","northwestern polytechnical university(northwestern polytechnical university,northwestern polytechnical univ),xi'an,china"
"university alabama birmingham, birmingham, al usa","univ alabama birmingham, birmingham, al usa","university alabama birmingham, birmingham, al usa"
"south china university of technology(south china university of technology,south china univ. of technol.),guangzhou,china","south china university of technology(south china university of technology,south china univ. of technol.),guangzhou,china","south china university of technology(south china university of technology,south china univ. of technol.),guangzhou,china"
"institute high energy physics, beijing 100049, peoples r china","inst high energy phys, beijing 100049, peoples r china","institute high energy physics, beijing 100049, peoples r china"
"university of electronic science and technology of china(university of electronic science and technology of china),chengdu,china","university of electronic science and technology of china(university of electronic science and technology of china),chengdu,china","university of electronic science and technology of china(university of electronic science and technology of china),chengdu,china"
"xidian university(xidian university,xidian univ.),xi an,china","xidian university(xidian university,xidian univ.),xi an,china","xidian university(xidian university,xidian univ.),xi an,china"
"chongqing university(chongqing university),chongqing,china","chongqing university(chongqing university),chongqing,china","chongqing university(chongqing university),chongqing,china"
instituto politecnico nacional,instituto politecnico nacional,instituto politecnico nacional
"nanjing university of aeronautics and astronautics(nanjing university of aeronautics and astronautics,nanjing univ. of aero. and astron.),nanjing,china","nanjing university of aeronautics and astronautics(nanjing university of aeronautics and astronautics,nanjing univ. of aero. and astron.),nanjing,china","nanjing university of aeronautics and astronautics(nanjing university of aeronautics and astronautics,nanjing univ. of aero. and astron.),nanjing,china"
texas a m university,texas a m university,texas a m university
"beijing university of technology(beijing university of technology,beijing polytechnic university),beijing,china","beijing university of technology(beijing university of technology,beijing polytechnic university),beijing,china","beijing university of technology(beijing university of technology,beijing polytechnic university),beijing,china"
"beijing university of posts and telecommunications(beijing university of posts and telecommunications,beijing univ. of posts and telecom.),beijing,china","beijing university of posts and telecommunications(beijing university of posts and telecommunications,beijing univ. of posts and telecom.),beijing,china","beijing university of posts and telecommunications(beijing university of posts and telecommunications,beijing univ. of posts and telecom.),beijing,china"
"china university of petroleum - beijing(china university of petroleum,university of petroleum),beijing,china","china university of petroleum - beijing(china university of petroleum,university of petroleum),beijing,china","china university of petroleum - beijing(china university of petroleum,university of petroleum),beijing,china"
federal university of parana,federal university of parana,federal university of parana
"university calif san diego, la jolla, ca 92093 usa","univ calif san diego, la jolla, ca 92093 usa","university calif san diego, la jolla, ca 92093 usa"
"north china electric power university(north china electric power university),beijing,china","north china electric power university(north china electric power university),beijing,china","north china electric power university(north china electric power university),beijing,china"
"university calif davis, davis, ca 95616 usa","univ calif davis, davis, ca 95616 usa","university calif davis, davis, ca 95616 usa"
"mem sloan kettering canc center, 1275 york ave, new york, ny 10021 usa","mem sloan kettering canc ctr, 1275 york ave, new york, ny 10021 usa","mem sloan kettering canc center, 1275 york ave, new york, ny 10021 usa"
"mem sloan kettering canc center, new york, ny 10021 usa","mem sloan kettering canc ctr, new york, ny 10021 usa","mem sloan kettering canc center, new york, ny 10021 usa"
"wuhan university of technology(wuhan university of technology),wuhan,china","wuhan university of technology(wuhan university of technology),wuhan,china","wuhan university of technology(wuhan university of technology),wuhan,china"
"university wisconsin, madison, wi usa","univ wisconsin, madison, wi usa","university wisconsin, madison, wi usa"
autor para correspondencia.,autor para correspondencia.,autor para correspondencia.
"beihang university(beijing university of aeronautics and astronautics,beihang university),beijing,china","beihang university(beijing university of aeronautics and astronautics,beihang university),beijing,china","beihang university(beijing university of aeronautics and astronautics,beihang university),beijing,china"
"nanjing university of science and technology(nanjing university of science and technology,nanjing univ. of sci. and technol.,nanjing univ. of sci. and technology,nust),nanjing,china","nanjing university of science and technology(nanjing university of science and technology,nanjing univ. of sci. and technol.,nanjing univ. of sci. and technology,nust),nanjing,china","nanjing university of science and technology(nanjing university of science and technology,nanjing univ. of sci. and technol.,nanjing univ. of sci. and technology,nust),nanjing,china"
"institute of high energy physics chinese academy of science(chinese academy of sciences,institute of high energy physics),beijing,china","institute of high energy physics chinese academy of science(chinese academy of sciences,institute of high energy physics),beijing,china","institute of high energy physics chinese academy of science(chinese academy of sciences,institute of high energy physics),beijing,china"
"harbin engineering university(harbin engineering university),harbin,china","harbin engineering university(harbin engineering university),harbin,china","harbin engineering university(harbin engineering university),harbin,china"
federal university of sao paulo,federal university of sao paulo,federal university of sao paulo
technische universitat munchen,technische universitat munchen,technische universitat munchen
"dana farber canc institute, boston, ma 02115 usa","dana farber canc inst, boston, ma 02115 usa","dana farber canc institute, boston, ma 02115 usa"
"university calif berkeley, berkeley, ca 94720 usa","univ calif berkeley, berkeley, ca 94720 usa","university calif berkeley, berkeley, ca 94720 usa"
"university n carolina, chapel hill, nc usa","univ n carolina, chapel hill, nc usa","university n carolina, chapel hill, nc usa"
"lawrence livermore national laboratory, livermore, ca 94550 usa","lawrence livermore natl lab, livermore, ca 94550 usa","lawrence livermore national laboratory, livermore, ca 94550 usa"
"penn state university, university pk, pa 16802 usa","penn state univ, university pk, pa 16802 usa","penn state university, university pk, pa 16802 usa"
"icahn sch medicine mt sinai, new york, ny 10029 usa","icahn sch med mt sinai, new york, ny 10029 usa","icahn sch medicine mt sinai, new york, ny 10029 usa"
"southwest jiaotong university(southwest jiaotong university,southwest jiaotong univ.),chengdu,china","southwest jiaotong university(southwest jiaotong university,southwest jiaotong univ.),chengdu,china","southwest jiaotong university(southwest jiaotong university,southwest jiaotong univ.),chengdu,china"
"china university of mining technology(china university of mining and technology,china univ. of mining and technol.),beijing,china","china university of mining technology(china university of mining and technology,china univ. of mining and technol.),beijing,china","china university of mining technology(china university of mining and technology,china univ. of mining and technol.),beijing,china"
empresa brasileira de pesquisa agropecuaria,empresa brasileira de pesquisa agropecuaria,empresa brasileira de pesquisa agropecuaria
vu university amsterdam,vu university amsterdam,vu university amsterdam
"beijing jiaotong daxue(beijing jiaotong university,northern jiaotong university),beijing,china","beijing jiaotong daxue(beijing jiaotong university,northern jiaotong university),beijing,china","beijing jiaotong daxue(beijing jiaotong university,northern jiaotong university),beijing,china"
"shanghai university(shanghai university),shanghai,china","shanghai university(shanghai university),shanghai,china","shanghai university(shanghai university),shanghai,china"
"jiangsu university(jiangsu university),zhenjiang,china","jiangsu university(jiangsu university),zhenjiang,china","jiangsu university(jiangsu university),zhenjiang,china"
"medicine college wisconsin, milwaukee, wi 53226 usa","med coll wisconsin, milwaukee, wi 53226 usa","medicine college wisconsin, milwaukee, wi 53226 usa"
"los alamos national laboratory, los alamos, nm 87545 usa","los alamos natl lab, los alamos, nm 87545 usa","los alamos national laboratory, los alamos, nm 87545 usa"
"oregon health and sciences university, portland, or 97201 usa","oregon hlth & sci univ, portland, or 97201 usa","oregon health and sciences university, portland, or 97201 usa"
"hunan university(hunan university,hunan univ.),changsha,china","hunan university(hunan university,hunan univ.),changsha,china","hunan university(hunan university,hunan univ.),changsha,china"
boston children s hospital,boston children s hospital,boston children s hospital
"brigham and womens hospital, boston, ma 02115 usa","brigham & womens hosp, boston, ma 02115 usa","brigham and womens hospital, boston, ma 02115 usa"
ecole polytechnique federale de lausanne,ecole polytechnique federale de lausanne,ecole polytechnique federale de lausanne
"east china university of science and technology(east china university of science and technology),shanghai,china","east china university of science and technology(east china university of science and technology),shanghai,china","east china university of science and technology(east china university of science and technology),shanghai,china"
"university calif berkeley, department chemical, berkeley, ca 94720 usa","univ calif berkeley, dept chem, berkeley, ca 94720 usa","university calif berkeley, department chemical, berkeley, ca 94720 usa"
"china university of geosciences(china university of geosciences),wuhan,china","china university of geosciences(china university of geosciences),wuhan,china","china university of geosciences(china university of geosciences),wuhan,china"
"university wisconsin, madison, wi 53706 usa","univ wisconsin, madison, wi 53706 usa","university wisconsin, madison, wi 53706 usa"
"institute of physics chinese academy of sciences(chinese academy of sciences),beijing,china","institute of physics chinese academy of sciences(chinese academy of sciences),beijing,china","institute of physics chinese academy of sciences(chinese academy of sciences),beijing,china"
"zhengzhou university(zhengzhou university),zhengzhou,china","zhengzhou university(zhengzhou university),zhengzhou,china","zhengzhou university(zhengzhou university),zhengzhou,china"
"cedars sinai medicine center, los angeles, ca 90048 usa","cedars sinai med ctr, los angeles, ca 90048 usa","cedars sinai medicine center, los angeles, ca 90048 usa"
"university calif san diego, san diego, ca 92103 usa","univ calif san diego, san diego, ca 92103 usa","university calif san diego, san diego, ca 92103 usa"
universidade federal de vicosa,universidade federal de vicosa,universidade federal de vicosa
"european organization for nuclear research(cern),geneve,switzerland","european organization for nuclear research(cern),geneve,switzerland","european organization for nuclear research(cern),geneve,switzerland"
"brigham and womens hospital, 75 francis st, boston, ma 02115 usa","brigham & womens hosp, 75 francis st, boston, ma 02115 usa","brigham and womens hospital, 75 francis st, boston, ma 02115 usa"
universite de montreal,universite de montreal,universite de montreal
"xiamen university(xiamen university),xiamen,china","xiamen university(xiamen university),xiamen,china","xiamen university(xiamen university),xiamen,china"
http://www.springermedizin.de,http://www.springermedizin.de,http://www.springermedizin.de
"soochow university(soochow university,suzhou university),suzhou,china","soochow university(soochow university,suzhou university),suzhou,china","soochow university(soochow university,suzhou university),suzhou,china"
university of brasilia,university of brasilia,university of brasilia
federal university of paraiba,federal university of paraiba,federal university of paraiba
author to whom correspondence should be addressed.,author to whom correspondence should be addressed.,author to whom correspondence should be addressed.
"university n carolina, chapel hill, nc 27515 usa","univ n carolina, chapel hill, nc 27515 usa","university n carolina, chapel hill, nc 27515 usa"
federal university of ceara,federal university of ceara,federal university of ceara
"university sao paulo, sao paulo, brazil","univ sao paulo, sao paulo, brazil","university sao paulo, sao paulo, brazil"
universite catholique de louvain,universite catholique de louvain,universite catholique de louvain
"university calif los angeles, david geffen sch medicine, los angeles, ca 90095 usa","univ calif los angeles, david geffen sch med, los angeles, ca 90095 usa","university calif los angeles, david geffen sch medicine, los angeles, ca 90095 usa"
"medicine university vienna, vienna, austria","med univ vienna, vienna, austria","medicine university vienna, vienna, austria"
"changchun institute of optics fine mechanics and physics chinese academy of sciences(chinese academy of sciences),changchun,china","changchun institute of optics fine mechanics and physics chinese academy of sciences(chinese academy of sciences),changchun,china","changchun institute of optics fine mechanics and physics chinese academy of sciences(chinese academy of sciences),changchun,china"
"beijing university of chemical technology(beijing university of chemical technology,beijing univ. of chemical technology),beijing,china","beijing university of chemical technology(beijing university of chemical technology,beijing univ. of chemical technology),beijing,china","beijing university of chemical technology(beijing university of chemical technology,beijing univ. of chemical technology),beijing,china"
"brookhaven national laboratory, upton, ny 11973 usa","brookhaven natl lab, upton, ny 11973 usa","brookhaven national laboratory, upton, ny 11973 usa"
"hohai university(hohai university,hohai univ.),nanjing,china","hohai university(hohai university,hohai univ.),nanjing,china","hohai university(hohai university,hohai univ.),nanjing,china"
"center dis control and prevent, atlanta, ga usa","ctr dis control & prevent, atlanta, ga usa","center dis control and prevent, atlanta, ga usa"
"chinese academy sciences, institute physics, beijing national laboratory condensed matter physics, beijing 100190, peoples r china","chinese acad sci, inst phys, beijing natl lab condensed matter phys, beijing 100190, peoples r china","chinese academy sciences, institute physics, beijing national laboratory condensed matter physics, beijing 100190, peoples r china"
"beijing university of aeronautics and astronautics(beijing university of aeronautics and astronautics,beijing univ. of aero. and astron.),beijing,china","beijing university of aeronautics and astronautics(beijing university of aeronautics and astronautics,beijing univ. of aero. and astron.),beijing,china","beijing university of aeronautics and astronautics(beijing university of aeronautics and astronautics,beijing univ. of aero. and astron.),beijing,china"
"hefei university of technology(hefei university of technology),hefei,china","hefei university of technology(hefei university of technology),hefei,china","hefei university of technology(hefei university of technology),hefei,china"
"university london imperial college sciences technology and medicine, london, england","univ london imperial coll sci technol & med, london, england","university london imperial college sciences technology and medicine, london, england"
"beth israel deaconess medicine center, boston, ma 02215 usa","beth israel deaconess med ctr, boston, ma 02215 usa","beth israel deaconess medicine center, boston, ma 02215 usa"
"china agricultural university(china agricultural university),beijing,china","china agricultural university(china agricultural university),beijing,china","china agricultural university(china agricultural university),beijing,china"
university of tubingen,university of tubingen,university of tubingen
"harvard smithsonian center astrophys, cambridge, ma 02138 usa","harvard smithsonian ctr astrophys, cambridge, ma 02138 usa","harvard smithsonian center astrophys, cambridge, ma 02138 usa"
"chinese academy of medical sciences(chinese academy of medical sciences),beijing,china","chinese academy of medical sciences(chinese academy of medical sciences),beijing,china","chinese academy of medical sciences(chinese academy of medical sciences),beijing,china"
"nanyang technology university, sch elect and elect engineering, singapore 639798, singapore","nanyang technol univ, sch elect & elect engn, singapore 639798, singapore","nanyang technology university, sch elect and elect engineering, singapore 639798, singapore"
"european org nucl research cern, geneva, switzerland","european org nucl res cern, geneva, switzerland","european org nucl research cern, geneva, switzerland"
"yanshan university(yanshan university),qinhuangdao,china","yanshan university(yanshan university),qinhuangdao,china","yanshan university(yanshan university),qinhuangdao,china"
dresden university of technology,dresden university of technology,dresden university of technology
"university fed sao paulo, sao paulo, brazil","univ fed sao paulo, sao paulo, brazil","university fed sao paulo, sao paulo, brazil"
