Origin Organizations,Cleaned,Filled
"charite, d-13353 berlin, germany","charite, d-13353 berlin, germany","charite, d-13353 berlin, germany"
"china jiliang university(china jiliang university ^),hangzhou,china","china jiliang university(china jiliang university ^),hangzhou,china","china jiliang university(china jiliang university ^),hangzhou,china"
"hebei normal university(hebei normal university),shijiazhuang,china","hebei normal university(hebei normal university),shijiazhuang,china","hebei normal university(hebei normal university),shijiazhuang,china"
"university calif berkeley,dept chem,berkeley,ca 94720","univ calif berkeley,dept chem,berkeley,ca 94720","university calif berkeley,dept chem,berkeley,ca 94720"
"university tehran medicine sciences, tehran, iran","univ tehran med sci, tehran, iran","university tehran medicine sciences, tehran, iran"
"university sciences and technology china, hefei national laboratory physics sciences microscale, hefei 230026, peoples r china","univ sci & technol china, hefei natl lab phys sci microscale, hefei 230026, peoples r china","university sciences and technology china, hefei national laboratory physics sciences microscale, hefei 230026, peoples r china"
"washington hospital center, washington, dc 20010 usa","washington hosp ctr, washington, dc 20010 usa","washington hospital center, washington, dc 20010 usa"
"city hope national medicine center, duarte, ca usa","city hope natl med ctr, duarte, ca usa","city hope national medicine center, duarte, ca usa"
"tokyo womens medicine university, tokyo, japan","tokyo womens med univ, tokyo, japan","tokyo womens medicine university, tokyo, japan"
"chongqing university of posts and telecommunications(chongqing university of posts and telecommunications),chongqing,china","chongqing university of posts and telecommunications(chongqing university of posts and telecommunications),chongqing,china","chongqing university of posts and telecommunications(chongqing university of posts and telecommunications),chongqing,china"
"university cattolica sacro cuore, rome, italy","univ cattolica sacro cuore, rome, italy","university cattolica sacro cuore, rome, italy"
"naval aeronautical engineering academy yantai(naval aeronautical engineering institute,naval aeronautical engineering academy),yantai,china","naval aeronautical engineering academy yantai(naval aeronautical engineering institute,naval aeronautical engineering academy),yantai,china","naval aeronautical engineering academy yantai(naval aeronautical engineering institute,naval aeronautical engineering academy),yantai,china"
"johns hopkins bloomberg sch publ health, department epidemiol, baltimore, md usa","johns hopkins bloomberg sch publ hlth, dept epidemiol, baltimore, md usa","johns hopkins bloomberg sch publ health, department epidemiol, baltimore, md usa"
"tufts medicine center, boston, ma usa","tufts med ctr, boston, ma usa","tufts medicine center, boston, ma usa"
"shandong agricultural university(shandong agricultural university),tainan,china","shandong agricultural university(shandong agricultural university),tainan,china","shandong agricultural university(shandong agricultural university),tainan,china"
"uniformed serv university health sciences, bethesda, md 20814 usa","uniformed serv univ hlth sci, bethesda, md 20814 usa","uniformed serv university health sciences, bethesda, md 20814 usa"
university of wisconsin,university of wisconsin,university of wisconsin
"chinese academy sciences, institute high energy physics, beijing, peoples r china","chinese acad sci, inst high energy phys, beijing, peoples r china","chinese academy sciences, institute high energy physics, beijing, peoples r china"
"university calif berkeley, department mol and cell biol, berkeley, ca 94720 usa","univ calif berkeley, dept mol & cell biol, berkeley, ca 94720 usa","university calif berkeley, department mol and cell biol, berkeley, ca 94720 usa"
et al,et al,et al
"beijing institute technology, sch mech engineering, beijing 100081, peoples r china","beijing inst technol, sch mech engn, beijing 100081, peoples r china","beijing institute technology, sch mech engineering, beijing 100081, peoples r china"
"princess margaret canc center, toronto, on, canada","princess margaret canc ctr, toronto, on, canada","princess margaret canc center, toronto, on, canada"
"vrije university brussel, brussels, belgium","vrije univ brussel, brussels, belgium","vrije university brussel, brussels, belgium"
"hannover medicine sch, d-3000 hannover, germany","hannover med sch, d-3000 hannover, germany","hannover medicine sch, d-3000 hannover, germany"
"carol davila university medicine and pharm, bucharest, romania","carol davila univ med & pharm, bucharest, romania","carol davila university medicine and pharm, bucharest, romania"
"netherlands canc institute, amsterdam, netherlands","netherlands canc inst, amsterdam, netherlands","netherlands canc institute, amsterdam, netherlands"
"research institute of petroleum exploration and development(research institute of petroleum exploration and development),beijing,china","research institute of petroleum exploration and development(research institute of petroleum exploration and development),beijing,china","research institute of petroleum exploration and development(research institute of petroleum exploration and development),beijing,china"
wroclaw university of technology,wroclaw university of technology,wroclaw university of technology
state university of west parana,state university of west parana,state university of west parana
"laboratoire de physique des particules (lapp), in2p3-cnrs, f-74019 annecy-le-vieux cedex, france","laboratoire de physique des particules (lapp), in2p3-cnrs, f-74019 annecy-le-vieux cedex, france","laboratoire de physique des particules (lapp), in2p3-cnrs, f-74019 annecy-le-vieux cedex, france"
paris,paris,paris
"university zurich hospital, ch-8091 zurich, switzerland","univ zurich hosp, ch-8091 zurich, switzerland","university zurich hospital, ch-8091 zurich, switzerland"
"shaanxi university of science and technology(shaanxi university of science and technology),xinyang,china","shaanxi university of science and technology(shaanxi university of science and technology),xinyang,china","shaanxi university of science and technology(shaanxi university of science and technology),xinyang,china"
"national university singapore, singapore 117548, singapore","natl univ singapore, singapore 117548, singapore","national university singapore, singapore 117548, singapore"
vision sciences inc,vision sciences inc,vision sciences inc
"university fed santa maria, santa maria, rs, brazil","univ fed santa maria, santa maria, rs, brazil","university fed santa maria, santa maria, rs, brazil"
university of munster,university of munster,university of munster
"fujian medical university(fujian medical university),fuzhou,china","fujian medical university(fujian medical university),fuzhou,china","fujian medical university(fujian medical university),fuzhou,china"
"university calif san diego, department bioengn, la jolla, ca 92093 usa","univ calif san diego, dept bioengn, la jolla, ca 92093 usa","university calif san diego, department bioengn, la jolla, ca 92093 usa"
"chinese academy sciences, changchun institute apply chemical, state key laboratory electroanalyt chemical, changchun 130022, jilin, peoples r china","chinese acad sci, changchun inst appl chem, state key lab electroanalyt chem, changchun 130022, jilin, peoples r china","chinese academy sciences, changchun institute apply chemical, state key laboratory electroanalyt chemical, changchun 130022, jilin, peoples r china"
"hubei general hospital(wuhan university,renmin hospital of wuhan university),wuhan,china","hubei general hospital(wuhan university,renmin hospital of wuhan university),wuhan,china","hubei general hospital(wuhan university,renmin hospital of wuhan university),wuhan,china"
"hong kong university of science and technology(hong kong university of science and technology,hong kong univ. of sci. and technol.),hong kong,china","hong kong university of science and technology(hong kong university of science and technology,hong kong univ. of sci. and technol.),hong kong,china","hong kong university of science and technology(hong kong university of science and technology,hong kong univ. of sci. and technol.),hong kong,china"
"national center atmospher research, boulder, co 80307 usa","natl ctr atmospher res, boulder, co 80307 usa","national center atmospher research, boulder, co 80307 usa"
"lensovet technology inst,leningrad,ussr","lensovet technol inst,leningrad,ussr","lensovet technology inst,leningrad,ussr"
"university calif berkeley, department mech engineering, berkeley, ca 94720 usa","univ calif berkeley, dept mech engn, berkeley, ca 94720 usa","university calif berkeley, department mech engineering, berkeley, ca 94720 usa"
"university calif los angeles, department materials sciences and engineering, los angeles, ca 90095 usa","univ calif los angeles, dept mat sci & engn, los angeles, ca 90095 usa","university calif los angeles, department materials sciences and engineering, los angeles, ca 90095 usa"
"university calif berkeley, department materials sciences and engineering, berkeley, ca 94720 usa","univ calif berkeley, dept mat sci & engn, berkeley, ca 94720 usa","university calif berkeley, department materials sciences and engineering, berkeley, ca 94720 usa"
"institut fr experimentelle kernphysik, karlsruhe, germany.","institut fr experimentelle kernphysik, karlsruhe, germany.","institut fr experimentelle kernphysik, karlsruhe, germany."
"seoul national university hospital, seoul, south korea","seoul natl univ hosp, seoul, south korea","seoul national university hospital, seoul, south korea"
"shenyang institute of applied ecology chinese academy of sciences(chinese academy of sciences),shenyang,china","shenyang institute of applied ecology chinese academy of sciences(chinese academy of sciences),shenyang,china","shenyang institute of applied ecology chinese academy of sciences(chinese academy of sciences),shenyang,china"
jet propulsion laboratory|california institute of technology,jet propulsion laboratory|california institute of technology,jet propulsion laboratory|california institute of technology
"max planck institute chemical physics solids, d-01187 dresden, germany","max planck inst chem phys solids, d-01187 dresden, germany","max planck institute chemical physics solids, d-01187 dresden, germany"
"university texas md anderson canc center, department biostat, houston, tx 77030 usa","univ texas md anderson canc ctr, dept biostat, houston, tx 77030 usa","university texas md anderson canc center, department biostat, houston, tx 77030 usa"
quaid i azam university,quaid i azam university,quaid i azam university
"guilin university of electronic technology(guilin university of electronic technology,guilin institute of technology),guilin,china","guilin university of electronic technology(guilin university of electronic technology,guilin institute of technology),guilin,china","guilin university of electronic technology(guilin university of electronic technology,guilin institute of technology),guilin,china"
"university texas md anderson canc center, houston, tx usa","univ texas md anderson canc ctr, houston, tx usa","university texas md anderson canc center, houston, tx usa"
"university basel hospital, ch-4031 basel, switzerland","univ basel hosp, ch-4031 basel, switzerland","university basel hospital, ch-4031 basel, switzerland"
"seoul national university hospital, seoul 110744, south korea","seoul natl univ hosp, seoul 110744, south korea","seoul national university hospital, seoul 110744, south korea"
"beijing university posts and telecommunications, state key laboratory networking and switching technology, beijing 100876, peoples r china","beijing univ posts & telecommun, state key lab networking & switching technol, beijing 100876, peoples r china","beijing university posts and telecommunications, state key laboratory networking and switching technology, beijing 100876, peoples r china"
"cea saclay(cea saclay),gif-sur-yvette,france","cea saclay(cea saclay),gif-sur-yvette,france","cea saclay(cea saclay),gif-sur-yvette,france"
"university health network, princess margaret canc center, toronto, on, canada","univ hlth network, princess margaret canc ctr, toronto, on, canada","university health network, princess margaret canc center, toronto, on, canada"
"florida hospital, orlando, fl usa","florida hosp, orlando, fl usa","florida hospital, orlando, fl usa"
university of ulsan college of medicine,university of ulsan college of medicine,university of ulsan college of medicine
"international center for elementary particle physics and department of physics, the university of tokyo, tokyo, japan.","international center for elementary particle physics and department of physics, the university of tokyo, tokyo, japan.","international center for elementary particle physics and department of physics, the university of tokyo, tokyo, japan."
agricultural applied economics association,agricultural applied economics association,agricultural applied economics association
"los alamos national laboratory, los alamos, nm usa","los alamos natl lab, los alamos, nm usa","los alamos national laboratory, los alamos, nm usa"
university of castilla la mancha,university of castilla la mancha,university of castilla la mancha
"china national petroleum corporation(cnpc,china national petroleum corporation),beijing,china","china national petroleum corporation(cnpc,china national petroleum corporation),beijing,china","china national petroleum corporation(cnpc,china national petroleum corporation),beijing,china"
"imperial college,london,united kingdom","imperial college,london,united kingdom","imperial college,london,united kingdom"
"university nacl autonoma mexico, mexico city, df, mexico","univ nacl autonoma mexico, mexico city, df, mexico","university nacl autonoma mexico, mexico city, df, mexico"
"korea adv institute sciences and technology, department elect engineering, taejon 305701, south korea","korea adv inst sci & technol, dept elect engn, taejon 305701, south korea","korea adv institute sciences and technology, department elect engineering, taejon 305701, south korea"
"university wisconsin,madison,wi 53706","univ wisconsin,madison,wi 53706","university wisconsin,madison,wi 53706"
"massachusetts general hosp,boston,ma 02114","massachusetts gen hosp,boston,ma 02114","massachusetts general hosp,boston,ma 02114"
magister,magister,magister
"university wisconsin, milwaukee, wi 53201 usa","univ wisconsin, milwaukee, wi 53201 usa","university wisconsin, milwaukee, wi 53201 usa"
"cedars sinai heart institute, los angeles, ca usa","cedars sinai heart inst, los angeles, ca usa","cedars sinai heart institute, los angeles, ca usa"
"chinese academy sciences, institute semicond, state key laboratory superlattices and microstruct, beijing 100083, peoples r china","chinese acad sci, inst semicond, state key lab superlattices & microstruct, beijing 100083, peoples r china","chinese academy sciences, institute semicond, state key laboratory superlattices and microstruct, beijing 100083, peoples r china"
"wake forest sch medicine, winston salem, nc usa","wake forest sch med, winston salem, nc usa","wake forest sch medicine, winston salem, nc usa"
"tokyo, japan","tokyo, japan","tokyo, japan"
"university calif san diego, department psychiat, la jolla, ca 92093 usa","univ calif san diego, dept psychiat, la jolla, ca 92093 usa","university calif san diego, department psychiat, la jolla, ca 92093 usa"
"oak ridge national laboratory, materials sciences and technology div, oak ridge, tn 37831 usa","oak ridge natl lab, mat sci & technol div, oak ridge, tn 37831 usa","oak ridge national laboratory, materials sciences and technology div, oak ridge, tn 37831 usa"
university of gottingen,university of gottingen,university of gottingen
"md anderson canc center, houston, tx usa","md anderson canc ctr, houston, tx usa","md anderson canc center, houston, tx usa"
"physics department, brookhaven national laboratory, upton, ny usa.","physics department, brookhaven national laboratory, upton, ny usa.","physics department, brookhaven national laboratory, upton, ny usa."
"montefiore medicine center, albert einstein college medicine, bronx, ny 10467 usa","montefiore med ctr, albert einstein coll med, bronx, ny 10467 usa","montefiore medicine center, albert einstein college medicine, bronx, ny 10467 usa"
"chinese academy sciences, technology institute physics and chemical, key laboratory photochem convers and optoelect materials, beijing 100190, peoples r china","chinese acad sci, tech inst phys & chem, key lab photochem convers & optoelect mat, beijing 100190, peoples r china","chinese academy sciences, technology institute physics and chemical, key laboratory photochem convers and optoelect materials, beijing 100190, peoples r china"
"sichuan agricultural university(sichuan agricultural university),ya'an,china","sichuan agricultural university(sichuan agricultural university),ya'an,china","sichuan agricultural university(sichuan agricultural university),ya'an,china"
"university calif san francisco, department radiol and biomed imaging, san francisco, ca 94143 usa","univ calif san francisco, dept radiol & biomed imaging, san francisco, ca 94143 usa","university calif san francisco, department radiol and biomed imaging, san francisco, ca 94143 usa"
"chinese university of hong kong(chinese university of hong kong,the chinese university of hong kong),hong kong,china","chinese university of hong kong(chinese university of hong kong,the chinese university of hong kong),hong kong,china","chinese university of hong kong(chinese university of hong kong,the chinese university of hong kong),hong kong,china"
"zhejiang normal university(zhejiang normal university),jinhua,china","zhejiang normal university(zhejiang normal university),jinhua,china","zhejiang normal university(zhejiang normal university),jinhua,china"
"liaocheng university(liaocheng university),liaocheng,china","liaocheng university(liaocheng university),liaocheng,china","liaocheng university(liaocheng university),liaocheng,china"
"georgia institute technology, sch civil and environm engineering, atlanta, ga 30332 usa","georgia inst technol, sch civil & environm engn, atlanta, ga 30332 usa","georgia institute technology, sch civil and environm engineering, atlanta, ga 30332 usa"
university of alcala,university of alcala,university of alcala
"national tsing hua university, department materials sciences and engineering, hsinchu 30013, taiwan","natl tsing hua univ, dept mat sci & engn, hsinchu 30013, taiwan","national tsing hua university, department materials sciences and engineering, hsinchu 30013, taiwan"
"nanyang technology university, sch physics and math sciences, div chemical and biol chemical, singapore 637371, singapore","nanyang technol univ, sch phys & math sci, div chem & biol chem, singapore 637371, singapore","nanyang technology university, sch physics and math sciences, div chemical and biol chemical, singapore 637371, singapore"
"university wisconsin, sch medicine and publ health, madison, wi usa","univ wisconsin, sch med & publ hlth, madison, wi usa","university wisconsin, sch medicine and publ health, madison, wi usa"
chung ang university,chung ang university,chung ang university
"nanjing university of information science and technology(nanjing university of information science and technology ^),nanjing,china","nanjing university of information science and technology(nanjing university of information science and technology ^),nanjing,china","nanjing university of information science and technology(nanjing university of information science and technology ^),nanjing,china"
"guizhou university(guizhou university),guiyang,china","guizhou university(guizhou university),guiyang,china","guizhou university(guizhou university),guiyang,china"
harvard-smithsonian center for astrophysics,harvard-smithsonian center for astrophysics,harvard-smithsonian center for astrophysics
"university sciences and technology beijing, state key laboratory adv metals, beijing 100083, peoples r china","univ sci & technol beijing, state key lab adv met, beijing 100083, peoples r china","university sciences and technology beijing, state key laboratory adv metals, beijing 100083, peoples r china"
"china three gorges university(china three gorges university,three gorges university),yichang,china","china three gorges university(china three gorges university,three gorges university),yichang,china","china three gorges university(china three gorges university,three gorges university),yichang,china"
"liaoning technical university(liaoning technical university),fuxin,china","liaoning technical university(liaoning technical university),fuxin,china","liaoning technical university(liaoning technical university),fuxin,china"
"ii physikalisches institut, georg-august-universitt, gttingen, germany.","ii physikalisches institut, georg-august-universitt, gttingen, germany.","ii physikalisches institut, georg-august-universitt, gttingen, germany."
"maimonides hospital, brooklyn, ny 11219 usa","maimonides hosp, brooklyn, ny 11219 usa","maimonides hospital, brooklyn, ny 11219 usa"
"university s florida, college medicine, h lee moffitt canc center and research institute, tampa, fl 33612 usa","univ s florida, coll med, h lee moffitt canc ctr & res inst, tampa, fl 33612 usa","university s florida, college medicine, h lee moffitt canc center and research institute, tampa, fl 33612 usa"
"university penn, department radiol, philadelphia, pa 19104 usa","univ penn, dept radiol, philadelphia, pa 19104 usa","university penn, department radiol, philadelphia, pa 19104 usa"
king s college cambridge,king s college cambridge,king s college cambridge
"university hospital geneva, geneva, switzerland","univ hosp geneva, geneva, switzerland","university hospital geneva, geneva, switzerland"
"guangzhou university(guangzhou university ^),guangzhou,china","guangzhou university(guangzhou university ^),guangzhou,china","guangzhou university(guangzhou university ^),guangzhou,china"
"culham sciences center, ccfe, abingdon ox14 3db, oxon, england","culham sci ctr, ccfe, abingdon ox14 3db, oxon, england","culham sciences center, ccfe, abingdon ox14 3db, oxon, england"
"state key laboratory of structural chemistry, fuzhou(chinese academy of sciences),fuzhou,china","state key laboratory of structural chemistry, fuzhou(chinese academy of sciences),fuzhou,china","state key laboratory of structural chemistry, fuzhou(chinese academy of sciences),fuzhou,china"
"xi'an institute of optics and precision mechanics chinese academy of sciences(chinese academy of sciences,xi'an institute of optics and precision mechanics),xi'an,china","xi'an institute of optics and precision mechanics chinese academy of sciences(chinese academy of sciences,xi'an institute of optics and precision mechanics),xi'an,china","xi'an institute of optics and precision mechanics chinese academy of sciences(chinese academy of sciences,xi'an institute of optics and precision mechanics),xi'an,china"
"imperial college, london, united kingdom.","imperial college, london, united kingdom.","imperial college, london, united kingdom."
"changzheng hospital(changzheng hospital,second military medical university),shanghai,china","changzheng hospital(changzheng hospital,second military medical university),shanghai,china","changzheng hospital(changzheng hospital,second military medical university),shanghai,china"
"walter reed army institute research, silver spring, md usa","walter reed army inst res, silver spring, md usa","walter reed army institute research, silver spring, md usa"
"china academy engineering physics, research center laser fus, mianyang 621900, peoples r china","china acad engn phys, res ctr laser fus, mianyang 621900, peoples r china","china academy engineering physics, research center laser fus, mianyang 621900, peoples r china"
to whom reprint requests should be addressed.,to whom reprint requests should be addressed.,to whom reprint requests should be addressed.
"bristol myers squibb co, princeton, nj usa","bristol myers squibb co, princeton, nj usa","bristol myers squibb co, princeton, nj usa"
"max planck institute festkorperforsch, d-70569 stuttgart, germany","max planck inst festkorperforsch, d-70569 stuttgart, germany","max planck institute festkorperforsch, d-70569 stuttgart, germany"
"chinese academy sciences, institute solid state physics, key laboratory materials physics, hefei 230031, peoples r china","chinese acad sci, inst solid state phys, key lab mat phys, hefei 230031, peoples r china","chinese academy sciences, institute solid state physics, key laboratory materials physics, hefei 230031, peoples r china"
"imperial college london(imperial college,imperial college london),london,united kingdom","imperial college london(imperial college,imperial college london),london,united kingdom","imperial college london(imperial college,imperial college london),london,united kingdom"
"university s carolina, department chemical and biochem, columbia, sc 29208 usa","univ s carolina, dept chem & biochem, columbia, sc 29208 usa","university s carolina, department chemical and biochem, columbia, sc 29208 usa"
author for correspondence.,author for correspondence.,author for correspondence.
"chinese academy sciences, institute rock and soil mech, state key laboratory geomech and geotech engineering, wuhan 430071, hubei, peoples r china","chinese acad sci, inst rock & soil mech, state key lab geomech & geotech engn, wuhan 430071, hubei, peoples r china","chinese academy sciences, institute rock and soil mech, state key laboratory geomech and geotech engineering, wuhan 430071, hubei, peoples r china"
